{
  "schema": "cuda-mcgs.framework-selection/0.2.0",
  "representation": "cuda-mcgs.search-ir/0.2.0",
  "status": "proposal-evidence",
  "contractSet": {
    "schema": "cuda-mcgs.search-ir.contract-set/0.2.0",
    "identity": {
      "algorithm": "sha256",
      "sha256": "c809cb1ba8dbe45d1b6b68ee63822ca72daecde2528974acb085a5500b512c46"
    }
  },
  "frameworkContract": {
    "kind": "catalog",
    "id": "SPEC-0000",
    "specificationIdentity": "CUDA-MCGS-SPEC-0000@0.1.0-draft",
    "sha256": "94ec8ab4fb61ecf94c0acf9d2143bd4922f4bdd32363a40d547ba7444f21d4e1"
  },
  "profiles": [
    {
      "id": "owner.domain",
      "role": "domain",
      "contract": {
        "kind": "catalog",
        "id": "SPEC-0007",
        "specificationIdentity": "CUDA-MCGS-SPEC-0007@0.1.0-draft",
        "sha256": "69512d49a4b0c5aae055bbba5c0a152db129f54037d7933f7f3b044a2547ad39"
      },
      "schema": { "id": "cuda-mcgs.domain-profile/0.2.0", "version": "0.2.0", "sha256": "34262bf95d2dff5fc450afb8c46f5fba2165b45f33a60918ea94a9f9302fe4e1" },
      "identity": { "algorithm": "sha256", "sha256": "29e77567df47d4aeb63660ae22c344d1a4b9d5eb68ebb30aadde80905d0f2b0d" }
    },
    {
      "id": "owner.graph",
      "role": "graph",
      "contract": {
        "kind": "catalog",
        "id": "SPEC-0010",
        "specificationIdentity": "CUDA-MCGS-SPEC-0010@0.1.0-draft",
        "sha256": "3a1ba6789648c47c8837713f9f61a0fd77ee4fa6fcfda8c24d1fd19f42895206"
      },
      "schema": { "id": "cuda-mcgs.graph-profile/0.2.0", "version": "0.2.0", "sha256": "607f67f008f7846346018b2c0837de6f20031bc9eed4ca442a85890508a5c716" },
      "identity": { "algorithm": "sha256", "sha256": "0b2dfe8585e89898619cc1d60bb9407495a3efa80bd60357447ff236dc3e9e98" }
    },
    {
      "id": "owner.output",
      "role": "output",
      "contract": {
        "kind": "catalog",
        "id": "SPEC-0013",
        "specificationIdentity": "CUDA-MCGS-SPEC-0013@0.1.0-draft",
        "sha256": "f9890c2814cfb2e647fdc9372fb9aa3ea02a8b561d9e35b530b5bcbd83f40087"
      },
      "schema": { "id": "cuda-mcgs.output-profile/0.2.0", "version": "0.2.0", "sha256": "b6e0d0723152d3d41b4bb7f636fbc4cf0a292a673858fc07f30aa83a83e58c07" },
      "identity": { "algorithm": "sha256", "sha256": "fe820714a4986b96bd0bb87485b9dac804873760f4d83abd5075a72861463fc1" }
    },
    {
      "id": "owner.policy",
      "role": "policy",
      "contract": {
        "kind": "catalog",
        "id": "SPEC-0008",
        "specificationIdentity": "CUDA-MCGS-SPEC-0008@0.1.0-draft",
        "sha256": "c33e33acf52f774b27e987c607da670344742a3075438bfc34984b34ac98dc11"
      },
      "schema": { "id": "cuda-mcgs.policy-profile/0.2.0", "version": "0.2.0", "sha256": "6adb8df41fd6f340ee1fbd7f0644dfa82e9da2b91588f5bc3074d8cda8e27720" },
      "identity": { "algorithm": "sha256", "sha256": "953c7793a69e53dbb5babe980a9fccf195aef2e5ea7fba1ec9770970362f4a26" }
    },
    {
      "id": "owner.program-package",
      "role": "program-package",
      "contract": {
        "kind": "catalog",
        "id": "SPEC-0005",
        "specificationIdentity": "CUDA-MCGS-SPEC-0005@0.4.0-draft",
        "sha256": "278a6df65efcc27269d621775369d8a356c91d85498daac25b720ac3fd5c85e7"
      },
      "schema": { "id": "cuda-mcgs.program-package-profile/0.2.0", "version": "0.2.0", "sha256": "aa4ef4718a1bd217023ea7d6c2f3cc7b376928b747957420d2d14790e39f26b2" },
      "identity": { "algorithm": "sha256", "sha256": "6817db5ed9b94bd6ac64795ab02163ed17624dc2b7dde7f9ff8c2cbd30a0bfd5" }
    },
    {
      "id": "owner.progress",
      "role": "progress",
      "contract": {
        "kind": "catalog",
        "id": "SPEC-0012",
        "specificationIdentity": "CUDA-MCGS-SPEC-0012@0.1.0-draft",
        "sha256": "709912998eadbd8001e1bed7103610c4b034cf864d5f991786fa983bbc031058"
      },
      "schema": { "id": "cuda-mcgs.progress-profile/0.2.0", "version": "0.2.0", "sha256": "68a76619ceec2ac0a195536b88caf3e753a9086cd18c7b4344f39437ea4d503a" },
      "identity": { "algorithm": "sha256", "sha256": "d4a4133698a88da9475c28d207b94b2575bbab85186f57f7ade58b2e1454c392" }
    },
    {
      "id": "owner.resource",
      "role": "resource",
      "contract": {
        "kind": "catalog",
        "id": "SPEC-0011",
        "specificationIdentity": "CUDA-MCGS-SPEC-0011@0.1.0-draft",
        "sha256": "286d25aefbbc5ce58bdf338cbf64778662af36671337f17aad867bb04aa8eda2"
      },
      "schema": { "id": "cuda-mcgs.resource-profile/0.2.0", "version": "0.2.0", "sha256": "54aaaaae27a945596d14f494e477473091e3e1ed0d019b51ea0661a8948d875b" },
      "identity": { "algorithm": "sha256", "sha256": "8c0a3cfd56f28acffebd1227b46ca73adba665828182c24678bdf535096ba4f5" }
    }
  ],
  "dependencies": [
    { "consumer": "owner.graph", "provider": "owner.domain", "reason": { "ownerProfile": "owner.domain", "id": "domain.identity", "version": "0.1.0" } },
    { "consumer": "owner.policy", "provider": "owner.domain", "reason": { "ownerProfile": "owner.domain", "id": "domain.roles", "version": "0.1.0" } },
    { "consumer": "owner.policy", "provider": "owner.graph", "reason": { "ownerProfile": "owner.graph", "id": "graph.ready-facts", "version": "0.1.0" } },
    { "consumer": "owner.resource", "provider": "owner.domain", "reason": { "ownerProfile": "owner.domain", "id": "domain.resource-contribution", "version": "0.1.0" } },
    { "consumer": "owner.resource", "provider": "owner.graph", "reason": { "ownerProfile": "owner.graph", "id": "graph.resource-contribution", "version": "0.1.0" } },
    { "consumer": "owner.resource", "provider": "owner.policy", "reason": { "ownerProfile": "owner.policy", "id": "policy.resource-contribution", "version": "0.1.0" } },
    { "consumer": "owner.progress", "provider": "owner.graph", "reason": { "ownerProfile": "owner.graph", "id": "graph.progress-transition", "version": "0.1.0" } },
    { "consumer": "owner.progress", "provider": "owner.policy", "reason": { "ownerProfile": "owner.policy", "id": "policy.work-readiness", "version": "0.1.0" } },
    { "consumer": "owner.progress", "provider": "owner.resource", "reason": { "ownerProfile": "owner.resource", "id": "resource.admission-transition", "version": "0.1.0" } },
    { "consumer": "owner.output", "provider": "owner.graph", "reason": { "ownerProfile": "owner.graph", "id": "graph.ready-view", "version": "0.1.0" } },
    { "consumer": "owner.output", "provider": "owner.policy", "reason": { "ownerProfile": "owner.policy", "id": "policy.ready-result-facts", "version": "0.1.0" } },
    { "consumer": "owner.output", "provider": "owner.progress", "reason": { "ownerProfile": "owner.progress", "id": "progress.closure", "version": "0.1.0" } },
    { "consumer": "owner.output", "provider": "owner.resource", "reason": { "ownerProfile": "owner.resource", "id": "resource.terminal-reserve", "version": "0.1.0" } },
    { "consumer": "owner.program-package", "provider": "owner.domain", "reason": { "ownerProfile": "owner.domain", "id": "domain.program-input", "version": "0.1.0" } },
    { "consumer": "owner.program-package", "provider": "owner.graph", "reason": { "ownerProfile": "owner.graph", "id": "graph.program-input", "version": "0.1.0" } },
    { "consumer": "owner.program-package", "provider": "owner.output", "reason": { "ownerProfile": "owner.output", "id": "output.program-input", "version": "0.1.0" } },
    { "consumer": "owner.program-package", "provider": "owner.policy", "reason": { "ownerProfile": "owner.policy", "id": "policy.program-input", "version": "0.1.0" } },
    { "consumer": "owner.program-package", "provider": "owner.progress", "reason": { "ownerProfile": "owner.progress", "id": "progress.program-input", "version": "0.1.0" } },
    { "consumer": "owner.program-package", "provider": "owner.resource", "reason": { "ownerProfile": "owner.resource", "id": "resource.program-input", "version": "0.1.0" } }
  ],
  "bindings": [
    {
      "id": "binding.domain-identity",
      "version": "0.1.0",
      "producer": { "ownerProfile": "owner.domain", "id": "domain.identity", "version": "0.1.0" },
      "consumers": [
        { "ownerProfile": "owner.graph", "id": "graph.domain-identity", "version": "0.1.0" },
        { "ownerProfile": "owner.policy", "id": "policy.domain-identity", "version": "0.1.0" }
      ],
      "permissions": [
        { "ownerProfile": "owner.domain", "id": "permission.domain-read-identity", "version": "0.1.0" }
      ],
      "representationOwner": "owner.domain",
      "lifecycleOwner": "owner.domain",
      "epochScope": { "ownerProfile": "owner.domain", "id": "domain.search-incarnation", "version": "0.1.0" },
      "resourceContributions": [],
      "progressDependencies": []
    },
    {
      "id": "binding.graph-ready-facts",
      "version": "0.1.0",
      "producer": { "ownerProfile": "owner.graph", "id": "graph.ready-facts", "version": "0.1.0" },
      "consumers": [
        { "ownerProfile": "owner.output", "id": "output.graph-ready-view", "version": "0.1.0" },
        { "ownerProfile": "owner.policy", "id": "policy.graph-ready-facts", "version": "0.1.0" }
      ],
      "permissions": [
        { "ownerProfile": "owner.graph", "id": "permission.graph-read-ready", "version": "0.1.0" }
      ],
      "representationOwner": "owner.graph",
      "lifecycleOwner": "owner.graph",
      "epochScope": { "ownerProfile": "owner.domain", "id": "domain.search-incarnation", "version": "0.1.0" },
      "resourceContributions": [
        { "ownerProfile": "owner.graph", "id": "graph.resource-contribution", "version": "0.1.0" }
      ],
      "progressDependencies": [
        { "ownerProfile": "owner.graph", "id": "graph.publication-readiness", "version": "0.1.0" }
      ]
    },
    {
      "id": "binding.policy-ready-result",
      "version": "0.1.0",
      "producer": { "ownerProfile": "owner.policy", "id": "policy.ready-result-facts", "version": "0.1.0" },
      "consumers": [
        { "ownerProfile": "owner.output", "id": "output.policy-ready-facts", "version": "0.1.0" }
      ],